{
  "arguments": [
    "--print",
    "--output-format",
    "json",
    "--model",
    "claude-opus-5",
    "--safe-mode",
    "--tools",
    "",
    "--disable-slash-commands",
    "--no-session-persistence",
    "--strict-mcp-config",
    "--mcp-config",
    "{\"mcpServers\":{}}",
    "--permission-mode",
    "dontAsk",
    "--setting-sources",
    "",
    "--settings",
    "{}",
    "--session-id",
    "38befa3e-1c0f-bfee-9746-55ba2e0c93d9"
  ],
  "bundle_path": "C:\\Users\\u\\AppData\\Local\\Temp\\coder-use-20260902-x193x8a8\\A_CLAUDE_USE_01",
  "bundle_sha256": "a72e12e31b0df0952760e7f0221e9668230049eb2ac8cb990dde3209e1b53511",
  "ended_at": "2026-09-02T01:55:58.510699+00:00",
  "executable": "claude",
  "exit_code": 0,
  "fresh_process": true,
  "input_sha256": "4437956dd13b85fcee81b53b687e980e332cd84e03e19cd502ba8e5291301d12",
  "launch_nonce": "38befa3e1c0fbfee974655ba2e0c93d9",
  "output_sha256": "186b05b5b332c909a2376093728301bb9b9ed4983d50c8a855715d207b1060c3",
  "pid": 6276,
  "ppid": 30352,
  "preexisting_family_pids": [
    192,
    6480,
    11652,
    12164,
    13048,
    14944,
    15712,
    15916,
    19952,
    22308,
    24436,
    29724,
    31140
  ],
  "process_create_time": 1788313821.9628181,
  "provider_auxiliary_models": [
    "claude-haiku-4-5-20251001"
  ],
  "provider_request_id": "38befa3e-1c0f-bfee-9746-55ba2e0c93d9",
  "provider_resolved_identity": {
    "family": "Claude",
    "model": "claude-opus-5",
    "provider": "anthropic",
    "source": "provider-response"
  },
  "requested_identity": {
    "family": "Claude",
    "model": "claude-opus-5",
    "provider": "anthropic"
  },
  "resumed": false,
  "runtime_controls": {
    "agent_loop": false,
    "mcp_servers": 0,
    "session_persistence": false,
    "tool_choice": "none",
    "tools_sent": 0
  },
  "schema": "all11_gpt_launch_receipt_v2",
  "session_id": "38befa3e-1c0f-bfee-9746-55ba2e0c93d9",
  "started_at": "2026-09-02T01:50:21.948230+00:00",
  "stderr_sha256": "e3b0c44298fc1c149afbf4c8996fb92427ae41e4649b934ca495991b7852b855",
  "stdout_sha256": "e2ae0a5023bc3c0d9e188161e2f6b96f8466e454ba7f9998af93836e545a71ac"
}
